{
 "schema": "acumos.schema.model:0.3.0",
 "name": "H2OModel",
 "runtime": {
   "encoding": "protobuf",
   "name": "h2o",
   "dependencies": {
     "java": {
       "indexes": [],
       "requirements": [
         {
           "name": "javac",
           "version": "1.8.0_131"
         },
         {
           "name": "java",
           "version": "1.8.0_131"
         },
         {
           "name": "protoc",
           "version": "3.4.0"
         }
       ]
     }
   },
   "version": "0.0.1"
 },
 "methods": {
   "transform": {
     "input": "DataFrame",
     "description": "Transforms a DataFrame to a Prediction",
     "output": "Prediction"
   }
 }
}